{
  "schemaVersion": 1,
  "sourceHash": "sha256:aef5471fda3eb4fb726396ae3f34a09eaaf447cb106792dc351bed7d1cb2de60",
  "currency": "CNY",
  "peakPolicy": {
    "weekdaysOnly": true,
    "windows": [
      {
        "start": "01:00",
        "end": "04:00"
      },
      {
        "start": "06:00",
        "end": "10:00"
      }
    ]
  },
  "models": [
    {
      "modelId": "deepseek-flash",
      "displayName": "Flash",
      "peak": {
        "inputCacheHit": 0.04,
        "inputCacheMiss": 2,
        "output": 8
      },
      "offPeak": {
        "inputCacheHit": 0.02,
        "inputCacheMiss": 1,
        "output": 4
      }
    },
    {
      "modelId": "deepseek-v4-pro",
      "displayName": "Pro",
      "peak": {
        "inputCacheHit": 0.3,
        "inputCacheMiss": 9,
        "output": 27
      },
      "offPeak": {
        "inputCacheHit": 0.15,
        "inputCacheMiss": 4.5,
        "output": 13.5
      }
    }
  ]
}
